<?xml version="1.0" encoding="utf-8"?>
<!DOCTYPE users SYSTEM "Users.dtd">

<users>
  <user id="002">
    <username>臭猪</username>
    <password>123456</password>
    <role>用户</role>
  </user>
   <user id="001">
    <username>臭猫</username>
    <password>123456</password>
    <role>用户</role>
  </user>
  

</users>
